{
 "title": "fn_boundary",
 "description": "TBD",
 "resources": [
  {
   "resourceType": "Observation",
   "id": "o1",
   "code": {
    "text": "code"
   },
   "status": "final",
   "valueQuantity": {
    "value": 1
   }
  },
  {
   "resourceType": "Observation",
   "id": "o2",
   "code": {
    "text": "code"
   },
   "status": "final",
   "valueDateTime": "2010-10-10"
  },
  {
   "resourceType": "Observation",
   "id": "o3",
   "code": {
    "text": "code"
   },
   "status": "final"
  }
 ],
 "tests": []
}