{
 "title": "fhirpath",
 "description": "fhirpath features",
 "resources": [
  {
   "resourceType": "Patient",
   "id": "pt1",
   "managingOrganization": {
    "reference": "Organization/o1"
   },
   "name": [
    {
     "family": "f1.1",
     "use": "official",
     "given": [
      "g1.1.1",
      "g1.1.2"
     ]
    },
    {
     "family": "f1.2",
     "given": [
      "g1.2.1"
     ]
    }
   ],
   "active": true
  },
  {
   "resourceType": "Patient",
   "id": "pt2",
   "managingOrganization": {
    "reference": "http://myapp.com/prefix/Organization/o2"
   },
   "name": [
    {
     "family": "f2.1"
    },
    {
     "family": "f2.2",
     "use": "official"
    }
   ],
   "active": false
  },
  {
   "resourceType": "Patient",
   "id": "pt3"
  }
 ],
 "tests": [
  {
   "title": "one element",
   "view": {
    "select": [
     {
      "column": [
       {
        "name": "id",
        "path": "id"
       }
      ],
      "type": "column"
     }
    ],
    "type": "select"
   },
   "expected": [
    {
     "id": "pt1"
    },
    {
     "id": "pt2"
    },
    {
     "id": "pt3"
    }
   ]
  },
  {
   "title": "two elements + first",
   "view": {
    "select": [
     {
      "column": [
       {
        "name": "v",
        "path": "name.family.first()"
       }
      ],
      "type": "column"
     }
    ],
    "type": "select"
   },
   "expected": [
    {
     "v": "f1.1"
    },
    {
     "v": "f2.1"
    },
    {
     "v": null
    }
   ]
  },
  {
   "title": "collection",
   "view": {
    "select": [
     {
      "column": [
       {
        "name": "v",
        "path": "name.family",
        "collection": true
       }
      ],
      "type": "column"
     }
    ],
    "type": "select"
   },
   "expected": [
    {
     "v": [
      "f1.1",
      "f1.2"
     ]
    },
    {
     "v": [
      "f2.1",
      "f2.2"
     ]
    },
    {
     "v": []
    }
   ]
  },
  {
   "title": "index[0]",
   "view": {
    "select": [
     {
      "column": [
       {
        "name": "v",
        "path": "name[0].family"
       }
      ],
      "type": "column"
     }
    ],
    "type": "select"
   },
   "expected": [
    {
     "v": "f1.1"
    },
    {
     "v": "f2.1"
    },
    {
     "v": null
    }
   ]
  },
  {
   "title": "index[1]",
   "view": {
    "select": [
     {
      "column": [
       {
        "name": "v",
        "path": "name[1].family"
       }
      ],
      "type": "column"
     }
    ],
    "type": "select"
   },
   "expected": [
    {
     "v": "f1.2"
    },
    {
     "v": "f2.2"
    },
    {
     "v": null
    }
   ]
  },
  {
   "title": "out of index",
   "view": {
    "select": [
     {
      "column": [
       {
        "name": "v",
        "path": "name[2].family"
       }
      ],
      "type": "column"
     }
    ],
    "type": "select"
   },
   "expected": [
    {
     "v": null
    },
    {
     "v": null
    },
    {
     "v": null
    }
   ]
  },
  {
   "title": "where",
   "view": {
    "select": [
     {
      "column": [
       {
        "name": "v",
        "path": "name.where(use='official').family"
       }
      ],
      "type": "column"
     }
    ],
    "type": "select"
   },
   "expected": [
    {
     "v": "f1.1"
    },
    {
     "v": "f2.2"
    },
    {
     "v": null
    }
   ]
  },
  {
   "title": "exists",
   "view": {
    "select": [
     {
      "column": [
       {
        "name": "id",
        "path": "id"
       },
       {
        "name": "has_name",
        "path": "name.exists()"
       }
      ],
      "type": "column"
     }
    ],
    "type": "select"
   },
   "expected": [
    {
     "id": "pt1",
     "has_name": true
    },
    {
     "id": "pt2",
     "has_name": true
    },
    {
     "id": "pt3",
     "has_name": false
    }
   ]
  },
  {
   "title": "nested exists",
   "view": {
    "select": [
     {
      "column": [
       {
        "name": "id",
        "path": "id"
       },
       {
        "name": "has_given",
        "path": "name.given.exists()"
       }
      ],
      "type": "column"
     }
    ],
    "type": "select"
   },
   "expected": [
    {
     "id": "pt1",
     "has_given": true
    },
    {
     "id": "pt2",
     "has_given": false
    },
    {
     "id": "pt3",
     "has_given": false
    }
   ]
  },
  {
   "title": "exists",
   "view": {
    "select": [
     {
      "column": [
       {
        "name": "id",
        "path": "id"
       },
       {
        "name": "first_given",
        "path": "name.given.first()"
       }
      ],
      "type": "column"
     }
    ],
    "type": "select"
   },
   "expected": [
    {
     "id": "pt1",
     "first_given": "g1.1.1"
    },
    {
     "id": "pt2",
     "first_given": null
    },
    {
     "id": "pt3",
     "first_given": null
    }
   ]
  },
  {
   "title": "exists",
   "view": {
    "select": [
     {
      "column": [
       {
        "name": "id",
        "path": "id"
       },
       {
        "name": "first_family",
        "path": "name.family.first()"
       }
      ],
      "type": "column"
     }
    ],
    "type": "select"
   },
   "expected": [
    {
     "id": "pt1",
     "first_family": "f1.1"
    },
    {
     "id": "pt2",
     "first_family": "f2.1"
    },
    {
     "id": "pt3",
     "first_family": null
    }
   ]
  },
  {
   "title": "string join",
   "view": {
    "select": [
     {
      "column": [
       {
        "name": "id",
        "path": "id"
       },
       {
        "name": "given",
        "path": "name.given.join(', ' )"
       }
      ],
      "type": "column"
     }
    ],
    "type": "select"
   },
   "expected": [
    {
     "id": "pt1",
     "given": "g1.1.1, g1.1.2, g1.2.1"
    },
    {
     "id": "pt2",
     "given": ""
    },
    {
     "id": "pt3",
     "given": ""
    }
   ]
  },
  {
   "title": "string join: default separator",
   "view": {
    "select": [
     {
      "column": [
       {
        "name": "id",
        "path": "id"
       },
       {
        "name": "given",
        "path": "name.given.join()"
       }
      ],
      "type": "column"
     }
    ],
    "type": "select"
   },
   "expected": [
    {
     "id": "pt1",
     "given": "g1.1.1g1.1.2g1.2.1"
    },
    {
     "id": "pt2",
     "given": ""
    },
    {
     "id": "pt3",
     "given": ""
    }
   ]
  },
  {
   "title": "getResourceKey()",
   "view": {
    "select": [
     {
      "column": [
       {
        "name": "id",
        "path": "getResourceKey()"
       }
      ],
      "type": "column"
     }
    ],
    "type": "select"
   },
   "expected": [
    {
     "id": "Patient/pt1"
    },
    {
     "id": "Patient/pt2"
    },
    {
     "id": "Patient/pt3"
    }
   ]
  },
  {
   "title": "getReferenceKey()",
   "view": {
    "select": [
     {
      "column": [
       {
        "name": "id",
        "path": "id"
       },
       {
        "name": "ref",
        "path": "managingOrganization.getReferenceKey()"
       }
      ],
      "type": "column"
     }
    ],
    "type": "select"
   },
   "expected": [
    {
     "id": "pt1",
     "ref": "Organization/o1"
    },
    {
     "id": "pt2",
     "ref": "Organization/o2"
    },
    {
     "id": "pt3",
     "ref": null
    }
   ]
  },
  {
   "title": "getReferenceKey(<type>)",
   "view": {
    "select": [
     {
      "column": [
       {
        "name": "id",
        "path": "id"
       },
       {
        "name": "ref",
        "path": "managingOrganization.getReferenceKey('Organization')"
       }
      ],
      "type": "column"
     }
    ],
    "type": "select"
   },
   "expected": [
    {
     "id": "pt1",
     "ref": "Organization/o1"
    },
    {
     "id": "pt2",
     "ref": "Organization/o2"
    },
    {
     "id": "pt3",
     "ref": null
    }
   ]
  },
  {
   "title": "getReferenceKey(<type>)",
   "view": {
    "select": [
     {
      "column": [
       {
        "name": "id",
        "path": "id"
       },
       {
        "name": "ref",
        "path": "managingOrganization.getReferenceKey('Encounter')"
       }
      ],
      "type": "column"
     }
    ],
    "type": "select"
   },
   "expected": [
    {
     "id": "pt1",
     "ref": null
    },
    {
     "id": "pt2",
     "ref": null
    },
    {
     "id": "pt3",
     "ref": null
    }
   ]
  }
 ]
}